{
  "version": "1.0",
  "case_id": "lincoln",
  "generated_at": "2026-06-28T10:31:47",
  "status": "draft-review-audit",
  "trace_policy": "Every trace row links a draft support claim to a support score, CMT mapping, MIPVU unit list, sentence ID, document metadata, source text path, and historical corroboration where available.",
  "traces": [
    {
      "trace_id": "lincoln-score-doc-lyceum-sacred_object-lincoln-cmt-001",
      "case_id": "lincoln",
      "generated_at": "2026-06-28T10:31:47",
      "claim_id": "lincoln-score-doc-lyceum-sacred_object",
      "claim_text": "Lyceum Address contributes moderate support evidence for sacred object (score 2.0/4): The address figures the nation as a living collective body but does not yet supply battlefield sacrifice or strong enemy-as-bringer-of-death evidence.",
      "claim_status": "interpretation",
      "claim_boundary": "Draft evidentiary-support assessment from reviewed pilot evidence; not proof, diagnosis, or monocausal historical explanation.",
      "support_dimension": "sacred_object",
      "support_dimension_label": "sacred object",
      "support_score_id": "lincoln-score-doc-lyceum",
      "support_score": 2.0,
      "support_score_path": "cases/lincoln/analysis/support-ratings.json",
      "document_weight": 1.0,
      "weight_rationale": "Standard early public-address benchmark; important for diachronic setup but not war enactment.",
      "cluster_id": "lincoln-05-fathers-inheritance",
      "mapping_id": "lincoln-cmt-001",
      "mapping_status": "provisional",
      "conceptual_metaphor": "HISTORY IS DEBT ACCOUNTING",
      "source_domain_primary": "debt_accounting",
      "target_domain": "history",
      "expression": "journal / account / running",
      "evidence_span": "In the great journal of things happening under the sun, we, the American people, find our account running under date of the nineteenth century of the Christian era.",
      "mapping_confidence": 0.82,
      "rival_reading": "Events under the sun are not literally a ledger, but the sentence frames history through accounting.",
      "mipvu_ids": [
        "lincoln-lyceum-address_s01_p04_s01_lu004",
        "lincoln-lyceum-address_s01_p04_s01_lu017",
        "lincoln-lyceum-address_s01_p04_s01_lu018"
      ],
      "mipvu_units": [
        {
          "mipvu_id": "lincoln-lyceum-address_s01_p04_s01_lu004",
          "lexical_unit": "journal",
          "decision_type": "mipvu_direct",
          "review_status": "reviewed",
          "confidence": 0.82,
          "path": "cases/lincoln/corpus/mipvu/lincoln-lyceum-address_mipvu.json"
        },
        {
          "mipvu_id": "lincoln-lyceum-address_s01_p04_s01_lu017",
          "lexical_unit": "account",
          "decision_type": "mipvu_direct",
          "review_status": "reviewed",
          "confidence": 0.82,
          "path": "cases/lincoln/corpus/mipvu/lincoln-lyceum-address_mipvu.json"
        },
        {
          "mipvu_id": "lincoln-lyceum-address_s01_p04_s01_lu018",
          "lexical_unit": "running",
          "decision_type": "mipvu_direct",
          "review_status": "reviewed",
          "confidence": 0.82,
          "path": "cases/lincoln/corpus/mipvu/lincoln-lyceum-address_mipvu.json"
        }
      ],
      "sentence_id": "lincoln-lyceum-address_s01_p04_s01",
      "sentence_text": "In the great journal of things happening under the sun, we, the American people, find our account running under date of the nineteenth century of the Christian era.",
      "segmented_sentence_path": "cases/lincoln/corpus/segmented/lincoln-lyceum-address.json",
      "document_id": "lincoln-lyceum-address",
      "document_title": "Address Before the Young Men's Lyceum of Springfield, Illinois",
      "document_date": "1838-01-27",
      "document_register": "public-address",
      "source_url": "https://www.gutenberg.org/cache/epub/3253/pg3253.txt",
      "source_citation": "Project Gutenberg EBook #3253 — The Papers and Writings of Abraham Lincoln, Complete, ed. Arthur Brooks Lapsley. Date note: Lapsley edition reads '1837'; correct date is 1838-01-27 per Basler, Collected Works vol. 1, p. 108.",
      "rights_status": "public-domain",
      "source_text_path": "cases/lincoln/corpus/raw/lincoln-src-01-lyceum-address.txt",
      "historical_note_ids": [
        "lincoln-hist-003"
      ],
      "historical_corroboration": [
        {
          "note_id": "lincoln-hist-003",
          "topic": "Lyceum republican survival rhetoric before the Civil War",
          "summary": "The Lyceum Address supplies early body-politic survival language, but its alignment is primarily rhetorical and civic rather than direct war enactment.",
          "corroboration_status": "limited-contextual alignment",
          "claim_boundary": "Useful for diachronic setup; does not by itself establish historical enactment."
        }
      ],
      "upstream_artifacts": [
        "cases/lincoln/analysis/support-ratings.json",
        "cases/lincoln/corpus/cmt/cmt-mappings.json",
        "cases/lincoln/analysis/historical-enactment-alignment.json",
        "cases/lincoln/metadata/document-manifest.json",
        "cases/lincoln/metadata/corpus-register.csv"
      ],
      "review_limitations": [
        "Trace rows are draft review aids, not final publication claims.",
        "Publication-grade historical citations remain required where historical notes say so.",
        "Scores are provisional and based on reviewed Lincoln pilot evidence.",
        "Codex-assisted full-corpus MIPVU review is complete for the frozen pre-v1 corpus, but independent human review and reliability adjudication remain pending.",
        "Historical alignment notes require publication-grade citations."
      ]
    },
    {
      "trace_id": "lincoln-score-doc-lyceum-sacrificial_body-lincoln-cmt-001",
      "case_id": "lincoln",
      "generated_at": "2026-06-28T10:31:47",
      "claim_id": "lincoln-score-doc-lyceum-sacrificial_body",
      "claim_text": "Lyceum Address contributes unsupported evidence for sacrificial body (score 0.0/4): The address figures the nation as a living collective body but does not yet supply battlefield sacrifice or strong enemy-as-bringer-of-death evidence.",
      "claim_status": "interpretation",
      "claim_boundary": "Draft evidentiary-support assessment from reviewed pilot evidence; not proof, diagnosis, or monocausal historical explanation.",
      "support_dimension": "sacrificial_body",
      "support_dimension_label": "sacrificial body",
      "support_score_id": "lincoln-score-doc-lyceum",
      "support_score": 0.0,
      "support_score_path": "cases/lincoln/analysis/support-ratings.json",
      "document_weight": 1.0,
      "weight_rationale": "Standard early public-address benchmark; important for diachronic setup but not war enactment.",
      "cluster_id": "lincoln-05-fathers-inheritance",
      "mapping_id": "lincoln-cmt-001",
      "mapping_status": "provisional",
      "conceptual_metaphor": "HISTORY IS DEBT ACCOUNTING",
      "source_domain_primary": "debt_accounting",
      "target_domain": "history",
      "expression": "journal / account / running",
      "evidence_span": "In the great journal of things happening under the sun, we, the American people, find our account running under date of the nineteenth century of the Christian era.",
      "mapping_confidence": 0.82,
      "rival_reading": "Events under the sun are not literally a ledger, but the sentence frames history through accounting.",
      "mipvu_ids": [
        "lincoln-lyceum-address_s01_p04_s01_lu004",
        "lincoln-lyceum-address_s01_p04_s01_lu017",
        "lincoln-lyceum-address_s01_p04_s01_lu018"
      ],
      "mipvu_units": [
        {
          "mipvu_id": "lincoln-lyceum-address_s01_p04_s01_lu004",
          "lexical_unit": "journal",
          "decision_type": "mipvu_direct",
          "review_status": "reviewed",
          "confidence": 0.82,
          "path": "cases/lincoln/corpus/mipvu/lincoln-lyceum-address_mipvu.json"
        },
        {
          "mipvu_id": "lincoln-lyceum-address_s01_p04_s01_lu017",
          "lexical_unit": "account",
          "decision_type": "mipvu_direct",
          "review_status": "reviewed",
          "confidence": 0.82,
          "path": "cases/lincoln/corpus/mipvu/lincoln-lyceum-address_mipvu.json"
        },
        {
          "mipvu_id": "lincoln-lyceum-address_s01_p04_s01_lu018",
          "lexical_unit": "running",
          "decision_type": "mipvu_direct",
          "review_status": "reviewed",
          "confidence": 0.82,
          "path": "cases/lincoln/corpus/mipvu/lincoln-lyceum-address_mipvu.json"
        }
      ],
      "sentence_id": "lincoln-lyceum-address_s01_p04_s01",
      "sentence_text": "In the great journal of things happening under the sun, we, the American people, find our account running under date of the nineteenth century of the Christian era.",
      "segmented_sentence_path": "cases/lincoln/corpus/segmented/lincoln-lyceum-address.json",
      "document_id": "lincoln-lyceum-address",
      "document_title": "Address Before the Young Men's Lyceum of Springfield, Illinois",
      "document_date": "1838-01-27",
      "document_register": "public-address",
      "source_url": "https://www.gutenberg.org/cache/epub/3253/pg3253.txt",
      "source_citation": "Project Gutenberg EBook #3253 — The Papers and Writings of Abraham Lincoln, Complete, ed. Arthur Brooks Lapsley. Date note: Lapsley edition reads '1837'; correct date is 1838-01-27 per Basler, Collected Works vol. 1, p. 108.",
      "rights_status": "public-domain",
      "source_text_path": "cases/lincoln/corpus/raw/lincoln-src-01-lyceum-address.txt",
      "historical_note_ids": [
        "lincoln-hist-003"
      ],
      "historical_corroboration": [
        {
          "note_id": "lincoln-hist-003",
          "topic": "Lyceum republican survival rhetoric before the Civil War",